<?xml version="1.0" encoding="UTF-8" standalone="yes"?>
<scenarioTree xmlns:xsi="http://www.w3.org/2001/XMLSchema-instance" xsi:noNamespaceSchemaLocation="https://yvesdrumbonnet.github.io/Adichatz-RCP-Update-Site/xsd/generator/scenarioTree.xsd">
    <params>
        <param value="C:/ADICHATZ/ECLIPSE/workspaces/4.9/workspace/adichatz/org.adichatz.studio" id="plugin.home"/>
        <param value="org.adichatz.studio" id="plugin.name"/>
        <param value="org.adichatz.studio" id="plugin.package"/>
        <param value="org.adichatz.generator.xjc" id="model.package.name"/>
        <param value="org.adichatz.studio.xjc.data.XjcPluginResources" id="plugin.resources.className"/>
        <param value="E:/ADICHATZ/ECLIPSE/eclipse.4.9" id="devl.eclipse.directory"/>
        <param value="C:/ADICHATZ/ECLIPSE/workspaces/4.9/workspace/adichatz" id="devl.workspace.directory"/>
        <param value="true" id="devl.create.xml.trace"/>
        <param value="######" id="devl.default.integer.pattern"/>
        <param value="2" id="devl.default.integer.scale"/>
        <param value="false" id="devl.format.generated.classes"/>
    </params>
    <generators>
        <generator treeClassName="org.adichatz.generator.wrapper.PluginEntityTreeWrapper" generatorClassName="org.adichatz.studio.xjc.scenario.XjcPluginEntityTreeGenerator"/>
        <generator treeClassName="org.adichatz.generator.wrapper.EntityTreeWrapper" generatorClassName="org.adichatz.studio.xjc.scenario.XjcEntityMetaModelGenerator"/>
        <generator treeClassName="org.adichatz.generator.wrapper.PartTreeWrapper" generatorClassName="org.adichatz.generator.PartTreeGenerator"/>
        <generator treeClassName="org.adichatz.generator.wrapper.ExtendTreeWrapper" generatorClassName="org.adichatz.generator.ExtendTreeGenerator"/>
        <generator treeClassName="org.adichatz.generator.wrapper.IncludeTreeWrapper" generatorClassName="org.adichatz.generator.IncludeTreeGenerator"/>
        <generator treeClassName="org.adichatz.generator.wrapper.ContainerTreeWrapper" generatorClassName="org.adichatz.generator.ContainerTreeGenerator"/>
        <generator treeClassName="#CONTROLGENERATOR()" generatorClassName="org.adichatz.studio.xjc.scenario.XjcControlGenerator"/>
        <generator treeClassName="org.adichatz.generator.wrapper.TreeManagerTreeWrapper" generatorClassName="org.adichatz.generator.TreeManagerGenerator"/>
        <generator treeClassName="org.adichatz.generator.wrapper.TableWrapper" generatorClassName="org.adichatz.generator.TableGenerator"/>
        <generator treeClassName="org.adichatz.generator.wrapper.GridWrapper" generatorClassName="org.adichatz.generator.GridGenerator"/>
    </generators>
    <pathElements>
        <pathElement type="PLUGIN" location="org.eclipse.swt.win32.win32.x86" additionalResourcePath="true"/>
        <pathElement type="PLUGIN" location="org.eclipse.swt.win32.win32.x86_64" additionalResourcePath="true"/>
        <pathElement type="PLUGIN" location="org.eclipse.jface"/>
        <pathElement type="PLUGIN" location="org.eclipse.ui.forms"/>
        <pathElement type="PLUGIN" location="org.eclipse.ui.views"/>
        <pathElement type="PLUGIN" location="org.eclipse.core.commands" additionalResourcePath="true"/>
        <pathElement type="PLUGIN" location="org.eclipse.core.resources"/>
        <pathElement type="PLUGIN" location="org.eclipse.core.jobs" additionalResourcePath="true"/>
        <pathElement type="PLUGIN" location="org.eclipse.ui.workbench" additionalResourcePath="true"/>
        <pathElement type="PLUGIN" location="org.eclipse.equinox.common" additionalResourcePath="true"/>
        <pathElement type="PLUGIN" location="org.eclipse.equinox.registry" additionalResourcePath="true"/>
        <pathElement type="PLUGIN" location="org.adichatz.common"/>
        <pathElement type="PLUGIN" location="org.adichatz.engine"/>
        <pathElement type="PLUGIN" location="org.adichatz.jpa"/>
        <pathElement type="PLUGIN" location="org.adichatz.source.resources" additionalResourcePath="true"/>
        <pathElement type="PLUGIN" location="org.adichatz.generator"/>
        <pathElement type="PLUGIN" location="org.adichatz.tool" additionalResourcePath="true"/>
        <pathElement type="DIRECTORY" location="#PLUGINHOME()/bin" additionalResourcePath="true"/>
        <pathElement type="DIRECTORY" location="#PLUGINHOME()/resources/gencode/bin" additionalResourcePath="true"/>
    </pathElements>
    <scenarios>
        <scenario type="PLUGIN_ENTITY" scenarioClassName="org.adichatz.studio.xjc.scenario.XjcPluginEntityScenario"/>
        <scenario type="ENTITY" scenarioClassName="org.adichatz.studio.xjc.scenario.XjcEntityScenario"/>
        <scenario type="DETAIL" scenarioClassName="org.adichatz.studio.xjc.scenario.XjcDetailPartScenario"/>
        <scenario type="MESSAGE_BUNDLE" scenarioClassName="org.adichatz.studio.xjc.scenario.XjcMessageBundleScenario"/>
    </scenarios>
    <controllers>
        <controller wrapperClassName="org.adichatz.generator.wrapper.ActionWrapper" controllerClassName="org.adichatz.engine.controller.action.ActionController"/>
        <controller wrapperClassName="org.adichatz.generator.wrapper.ButtonBarWrapper" controllerClassName="org.adichatz.engine.controller.collection.ButtonBarController"/>
        <controller wrapperClassName="org.adichatz.generator.wrapper.ButtonWrapper" controllerClassName="org.adichatz.engine.controller.action.ButtonController"/>
        <controller wrapperClassName="org.adichatz.generator.wrapper.CheckBoxWrapper" controllerClassName="org.adichatz.engine.controller.field.CheckBoxController"/>
        <controller wrapperClassName="org.adichatz.generator.wrapper.CComboWrapper" controllerClassName="org.adichatz.engine.controller.field.CComboController"/>
        <controller wrapperClassName="org.adichatz.generator.wrapper.ComboWrapper" controllerClassName="org.adichatz.engine.controller.field.ComboController"/>
        <controller wrapperClassName="org.adichatz.generator.wrapper.CompositeWrapper" controllerClassName="org.adichatz.engine.controller.collection.CompositeController"/>
        <controller wrapperClassName="org.adichatz.generator.wrapper.CTabFolderWrapper" controllerClassName="org.adichatz.engine.controller.collection.CTabFolderController"/>
        <controller wrapperClassName="org.adichatz.generator.wrapper.CTabItemWrapper" controllerClassName="org.adichatz.engine.controller.collection.CTabItemController"/>
        <controller wrapperClassName="org.adichatz.generator.wrapper.DateTextWrapper" controllerClassName="org.adichatz.engine.controller.field.DateTextController"/>
        <controller wrapperClassName="org.adichatz.generator.wrapper.DetailPartWrapper" controllerClassName="org.adichatz.engine.controller.collection.DetailPageController"/>
        <controller wrapperClassName="org.adichatz.generator.wrapper.EncryptedTextWrapper" controllerClassName="org.adichatz.engine.controller.field.EncryptedTextController"/>
        <controller wrapperClassName="org.adichatz.generator.wrapper.ExtraTextWrapper" controllerClassName="org.adichatz.engine.controller.field.ExtraTextController"/>
        <controller wrapperClassName="org.adichatz.generator.wrapper.FileTextWrapper" controllerClassName="org.adichatz.engine.controller.field.FileTextController"/>
        <controller wrapperClassName="org.adichatz.generator.wrapper.FormPageWrapper" controllerClassName="org.adichatz.engine.indigo.controller.LegacyFormPageController"/>
        <controller wrapperClassName="org.adichatz.generator.wrapper.GroupWrapper" controllerClassName="org.adichatz.engine.controller.collection.GroupController"/>
        <controller wrapperClassName="org.adichatz.generator.wrapper.HelpButtonWrapper" controllerClassName="org.adichatz.engine.controller.action.HelpButtonController"/>
        <controller wrapperClassName="org.adichatz.generator.wrapper.HyperlinkWrapper" controllerClassName="org.adichatz.engine.controller.field.HyperlinkController"/>
        <controller wrapperClassName="org.adichatz.generator.wrapper.ImageViewerWrapper" controllerClassName="org.adichatz.engine.controller.field.ImageViewerController"/>
        <controller wrapperClassName="org.adichatz.generator.wrapper.IncludeWrapper" controllerClassName="org.adichatz.engine.controller.collection.IncludeController"/>
        <controller wrapperClassName="org.adichatz.generator.wrapper.LabelWrapper" controllerClassName="org.adichatz.engine.controller.field.LabelController"/>
        <controller wrapperClassName="org.adichatz.generator.wrapper.ManagedToolBarWrapper" controllerClassName="org.adichatz.engine.controller.collection.ManagedToolBarController"/>
        <controller wrapperClassName="org.adichatz.generator.wrapper.MasterDetailPageWrapper" controllerClassName="org.adichatz.engine.controller.collection.MasterDetailPageController"/>
        <controller wrapperClassName="org.adichatz.generator.wrapper.MenuActionWrapper" controllerClassName="org.adichatz.engine.controller.action.MenuActionController"/>
        <controller wrapperClassName="org.adichatz.generator.wrapper.MenuItemWrapper" controllerClassName="org.adichatz.engine.controller.action.MenuItemController"/>
        <controller wrapperClassName="org.adichatz.generator.xjc.MenuManagerType" controllerClassName="org.adichatz.engine.controller.collection.MenuManagerController"/>
        <controller wrapperClassName="org.adichatz.generator.wrapper.MultiChoiceWrapper" controllerClassName="org.adichatz.engine.controller.field.MultiChoiceController"/>
        <controller wrapperClassName="org.adichatz.generator.wrapper.NumericTextWrapper" controllerClassName="org.adichatz.engine.controller.field.NumericTextController"/>
        <controller wrapperClassName="org.adichatz.generator.wrapper.RadioGroupWrapper" controllerClassName="org.adichatz.engine.controller.field.RadioGroupController"/>